caption,url,helsinki_translation,madlad_translation,phi_translation,dataset_similarity,similarity_helsinki,similarity_madlad,similarity_phi
"Over a million fans have attended the Wheelmobile events. Here's what it looks like, can't miss it. - PRESS RELEASE FROM WHEEL OF FORTUNE MEDIA",https://media1.fdncms.com/tucsonweekly/imager/u/blog/7420737/screen_shot_2017-02-09_at_12.43.25_pm.png?cb=1507765290,"Oltre un milione di fan hanno partecipato agli eventi di Wheelmobile. Ecco come sembra, non può mancare. - COMUNICATO STAMPA DA WHEEL OF FORTUNE MEDIA","Oltre un milione di fan hanno partecipato agli eventi Wheelmobile, ecco come sono stati, non potete perdervelo. - COMUNICATO STAMPA DEI MEDIA WHEEL OF FORTUNE","Over un milione di fan hanno partecipato agli eventi Wheelmobile. Ecco cosa sembra, non può mancare. - RISKA E D'AMICO FROM WHEEL OF FORTUNE MEDIA",0.38102757930755615,0.2634966969490051,0.2888244390487671,0.28615084290504456
Cocoa powder and cocao beans on the wooden table.,https://image.shutterstock.com/image-photo/cocoa-powder-cocao-beans-on-260nw-388187059.jpg,Cacao in polvere e fagioli di cacao sul tavolo di legno.,#40000000 - Cacao in polvere e fagioli di cacao sul tavolo di legno.,'Powder di cacao e semi di cacao su un tavolo in legno.',0.3073278069496155,0.667964518070221,0.6970229744911194,0.6984652280807495
Relaxing on my thinlite pad and window film ground sheet on the Bigfoot Trail,https://i1.wp.com/sageclegg.com/wp-content/uploads/2014/12/IMG_6257.jpg?resize=300%2C228,Rilassarsi sul mio pad sottile e foglio di pellicola di finestra terra sul Bigfoot Trail,Rilassandosi sul mio pad thinlite e sul mio foglio di pellicola per finestre sul Bigfoot Trail,Rilassarsi sul mio padlite e strato di film per finestre sul percorso del Bigfoot,0.28990811109542847,0.5240741968154907,0.5435704588890076,0.5358706712722778
World Sailing,http://2017worlds.420sailing.org/uploaded_files/Banner_1028_20170228222354_en.jpg,Vela mondiale,World Sailing - 2016,'World Sailing' translated into Italian is 'World Sailing'.,0.3637847602367401,0.4085467457771301,0.4907833933830261,0.4299769401550293
"THE EMPIRE STRIKES BACK,  Dave Prowse, Billy Dee Williams, 1980, Lucasfilms /",https://media.baselineresearch.com/images/80570/80570_full.jpg,"The Empire Strikes Back, Dave Prowse, Billy Dee Williams, 1980, Lucasfilms /","L'IMPERO RITORNA,  Dave Prowse, Billy Dee Williams, 1980, Lucasfilms /","La caption tradotta in italiano sarebbe: 'L'AVVENTATORE STAR WARS, Dave Prowse, Billy Dee Williams, 1980, Lucasfilm'.",0.32535725831985474,0.3984368145465851,0.49783259630203247,0.527625560760498
Roy Buchanan - A Nickel and a Nail,https://is5-ssl.mzstatic.com/image/thumb/Features/7c/e1/ad/dj.sppwqgji.jpg/170x170bb.jpg,Roy Buchanan - Un Nickel e un Chiodo,Roy Buchanan - Un nichel e un chiodo,Roy Buchanan - Un Nickel e Un Nail,0.35401651263237,0.3478246033191681,0.28015345335006714,0.22797095775604248
Trulucks_SoftShellCrab_AY01-Large,https://cravedfw.files.wordpress.com/2019/05/trulucks_softshellcrab_ay01-large.jpg?w=500,Trulucks_SoftShellCrab_AY01-Large,Trulucks_SoftShellCrab_AY01-Large,"Trulucks Softshell Crab AY01-Large


Trulucks Softshell Crab AY01-Large",0.3051685392856598,0.05490250885486603,0.05490250885486603,0.17599326372146606
"Reviewing Logitech K400 Wireless Touch Keyboard - HTPC, Media Center, PLeX, XBMC",https://i.ytimg.com/vi/2Z9kIZ_vKnU/mqdefault.jpg,"Recensione di Logitech K400 Wireless Touch Keyboard - HTPC, Media Center, PLeX, XBMC","La tua recensione di Logitech K400 Wireless Touch Keyboard - HTPC, Media Center, PLeX, XBMC","Rivedere il keybordi Logitech K400 Wireless Touch - HTPC, Media Center, PLeX, XBMC",0.3765636384487152,0.4317168593406677,0.4390240013599396,0.458980530500412
"""<div class=""""meta image-caption""""><div class=""""origin-logo origin-image """"><span></span></div><span class=""""caption-text"""">Nothing like kindling the fire of hospitality in red festive Christmas tree pants, Tom of Seal Beach came out to support the Stuff-A-Bus toy drive at Los Cerritos Center in Cerritos on Friday, Dec. 7, 2012. (KABC Photo)</span></div>""",https://cdn.abclocal.go.com/images/kabc/cms_exf_2007/resources/lifestyle_community/community/121207-galleryimg-stuff-a-bus-cerritos-tom.JPG,"""<div class=""""meta image-caption""""><div class=""""origine-logo origin-image""""><span></span></div><span class=""""caption-text"">Nulla come accendere il fuoco dell'ospitalità nei pantaloni rossi dell'albero di Natale, Tom of Seal Beach è uscito per sostenere la Stuff-A-Bus toy drive al Los Cerritos Center di Cerritos venerdì 7 dicembre 2012. (KABC Photo)</span></div>""","""<div class=""""meta image-caption""""><div class=""""origin-logo origin-image """"><span></span></div><span class=""""caption-text"""">Niente di meglio che accendere il fuoco dell'ospitalità in pantaloni rossi festivi dell'albero di Natale, Tom di Seal Beach è venuto a sostenere la raccolta di giocattoli Stuff-A-Bus al Los Cerritos Center a Cerritos venerdì 7 dicembre 2012. (Foto KBC)</span></div>""","""Niente come accendere il fuoco dell'ospitalità in pantaloni di albero di Natale di natale a forma di albero in pantaloni di natale, Tom di Seal Beach è uscito per supportare il drive di donazione di giocattoli al Stuff-A-Bus al Centro di Cerritos a Cerritos di domenica, 7 dicembre 2012. (Foto di KABC)""",0.3058544397354126,0.3362315595149994,0.35272276401519775,0.3522978723049164
cdbnails: 12 Days of Christmas Nail Art | Nightmare Before ...,https://2.bp.blogspot.com/-yBIx0pbwf54/VnitiGpYcSI/AAAAAAAAJXU/aXLmQcPpOgk/s1600/NMBC2.jpg,cdbnails: 12 Giorni di Nail Art di Natale | Incubo Prima ...,cdbnails: 12 Giorni di Natale Nail Art | Nightmare Before Christmas,<|input|>,0.33143067359924316,0.6577152609825134,0.6317622661590576,0.0841398760676384
Regeneration Master Icon.png,https://gamepedia.cursecdn.com/allstars_gamepedia/thumb/d/dd/Regeneration_Master_Icon.png/64px-Regeneration_Master_Icon.png?version=b0148ceae082fa36a79438690e258411,Rigenerazione Master Icon.png,Rigenerazione Master Icon.png,"Il logo del ""Regeneration Master"" è un'immagine stilizzata di un umano con le braccia estese, circondato da un anello verde luminoso.",0.32448771595954895,0.6378241181373596,0.6378241181373596,0.6068496704101562
The Language of Letting Go PDF,https://books.google.com/books/content/images/frontcover/5j8MAAAACAAJ?fife=w150-h200,Il linguaggio di Letting Go PDF,Il linguaggio del lasciarsi andare PDF,Il libro 'La lingua della perdita' in formato PDF,0.3475532829761505,0.33475711941719055,0.5007905960083008,0.44435983896255493
Carved and Painted Wood Yacht Model,https://images.skinnerinc.com/square/phpThumb.php?src=/full/985/1175985.jpg&ws=252&hs=252,Modello di yacht in legno intagliato e verniciato,Modello di yacht in legno intagliato e dipinto,'Modellino di yacht in legno scolpito e dipinto',0.3270914554595947,0.19071796536445618,0.16567377746105194,0.16882246732711792
typical southwest florida... | Shutterstock . vector #372167356,https://thumb9.shutterstock.com/image-photo/redirected-150nw-372167356.jpg,| Shutterstock. vettore #372167356,Tipico sud-ovest della florida... | Shutterstock.com,"Tradizionale Florida sud-occidentale... | Shutterstock. vettore # 372167356






Tradizionale Florida sud-occidentale... | Shutterstock. vettore # 372167356",0.2903497517108917,0.12438540160655975,0.18928861618041992,0.11383996158838272
Nigeria News - How To Earn more than $6000 in the next 5 months,http://i.ytimg.com/vi/0Rrp0YxsRz0/0.jpg,Nigeria News - Come guadagnare più di $6000 nei prossimi 5 mesi,Nigeria News - Come guadagnare più di $ 6000 nei prossimi 5 mesi,Nigeria News - Come guadagnare più di $6000 in 5 mesi,0.3042494058609009,0.5524959564208984,0.5524959564208984,0.5354498624801636
Abstract seamless wallpaper with flowers,https://image.shutterstock.com/image-vector/abstract-seamless-wallpaper-flowers-260nw-93409630.jpg,Carta da parati astratta senza cuciture con fiori,Astratto sfondo senza soluzione di continuità con fiori,Abstracto come fondo a strati con fiori,0.3000437617301941,0.6174803376197815,0.5477482080459595,0.4796718657016754
Design a Snow Globe Template 1,https://www.easypeasyandfun.com/wp-content/uploads/2020/10/Design-a-Snow-Globe-Template-1.jpg,Progetta un modello di globo di neve 1,Progettare un Modello di Globo di Neve 1,Crea un modello di scatola di neve 1,0.3040897846221924,0.5079743266105652,0.46618378162384033,0.5937501192092896
Wassercollage Stockfotos,https://thumbs.dreamstime.com/t/wassercollage-23192163.jpg,"Wassercollage StockfotosCity name (optional, probably does not need a translation)",Foto d'archivio di collage dell'acqua,"<|answer|> 

Il collage mostra varie scene di mare e coste.",0.31615063548088074,0.1788424253463745,0.48342105746269226,0.4967600703239441
Warframe Syndicates Saryn's Contagion Cloud thequickdraw,https://vignette.wikia.nocookie.net/warframe/images/6/64/Warframe_Syndicates_Saryn%27s_Contagion_Cloud_thequickdraw/revision/latest/scale-to-width-down/300?cb=20150607093422,Warframe Syndicates Contagion Cloud di Saryn thequickdraw,Nuvola di Contagio di Saryn thequickdraw,Il contagio delle nuvole di Saryn nel Warframe,0.3803878724575043,0.3421727418899536,0.20090433955192566,0.3814229965209961
Baltimore Ravens Flag 3x5,https://cdn.shopify.com/s/files/1/1050/9876/products/3208586330_480x480.jpg?v=1498684929,Baltimora Ravens Bandiera 3x5,Baltimore Ravens Bandiera 3x5,Flagge Baltimore Ravens 3x5,0.36217331886291504,0.424137145280838,0.47310900688171387,0.32845616340637207
thanksgiving hostess gifts thanksgiving gift ideas gifs show more gifs,http://t0.gstatic.com/images?q=tbn:ANd9GcREKlQuR35dvJC-yB0xcl7ktRjwMAH0ZPG95K15zkEC7QHkeXTT,Ringraziamento hostess regali Ringraziamento idee regalo gifs mostrare più gifs,Gifs Animati di Regali di Ringraziamento Regali di Ringraziamento Gifs Animati di Idee Regalo di Ringraziamento,La tradizionale festa di ringhiata di fine anno.,0.3070123791694641,0.5258350372314453,0.46530693769454956,-0.07839503139257431
Tome7,https://images-eu.ssl-images-amazon.com/images/I/513kywaffxL._SL160_.jpg,"Tome7City name (optional, probably does not need a translation)",Volume 7,Tome 7,0.28165751695632935,0.24110907316207886,0.24585935473442078,0.21026498079299927
Watch Tuvaband Wolfpack video,https://i.ytimg.com/vi/VhNmIqaNSDg/mqdefault.jpg,Guarda il video di Tuvaband Wolfpack,Guarda il video di Tuvaband Wolfpack,'Vedi il video di Tuvaband Wolfpack',0.3069145977497101,0.2982708811759949,0.2982708811759949,0.3242025673389435
KSA home builders web application,https://cdn3.f-cdn.com//files/download/52972067/637c6f.jpg,Applicazione web di KSA home builders,Applicazione web per i costruttori di case KSA,'Applicazione web per costruttori di case in KSA',0.30833303928375244,0.42991068959236145,0.45008668303489685,0.5024201273918152
Ride along motorcycle,https://img.freepik.com/vettori-gratuito/ride-along-motorcycle_56819-16.jpg?size=338&ext=jpg,Cavalca lungo la motocicletta,Guida lungo moto,'Andare in giro con motocicletta',0.30411645770072937,0.33692699670791626,0.3208313584327698,0.5107403993606567
"B.J. Penn Quotes: It's not a certain technique, it's not a skillit's all in your mind, it's how far you want to go",https://www.wisefamousquotes.com/b-j-penn-quotes/it039s-not-a-certain-technique-it039s-not-a-867519-11.jpg,"B.J. Penn Quotazioni: Non è una certa tecnica, non è un abilità è tutto nella tua mente, è quanto lontano si vuole andare","Non è una certa tecnica, non è un'abilità, è tutto nella tua mente, è quanto lontano vuoi andare","Non è una tecnica specifica, non è una abilità, tutto dipende da quanto vai avanti nella tua mente.",0.31698861718177795,0.5060110092163086,0.5916882753372192,0.5544070601463318
Purple Swirl Greyhound Shirts,http://rlv.zcache.com/purple_swirl_greyhound_shirts-rb17b353563c74ddf8c31f4da9dc34932_8nhmp_216.jpg,Camicia a levriero viola,Purple Swirl Greyhound Magliette e T-shirt,Traduzione della frase integrale: 'T-shirt con disegno a scelo in tinta di viola',0.310092568397522,0.38537168502807617,0.5184713006019592,0.5095265507698059
Age Defying REFINE Thermal Mask,https://row.seacretspa.com/media/catalog/product/cache/aefcd4d8d5c59ba860378cf3cd2e94da/r/e/refine_1.jpg,Età Sfidare REFINE maschera termica,Age Defying REFINE Maschera termica,'Maschera Rinomoregenerante da 30 giorni',0.3193937838077545,0.26385697722435,0.22356821596622467,0.18860433995723724
Pigeons in the park Stock Footage,https://images.pond5.com/pigeons-park-footage-055332776_iconm.jpeg,Piccioni nel parco Fotografie,Piccioni nel parco Stock Footage,Pigeoni nel parco - Stock Footage,0.3393574357032776,0.567712128162384,0.5570144653320312,0.25877076387405396
MEDBOX™ - Healthcare Mobile Application,http://thumbs.slideserve.com/1_7369740.jpg,MEDBOXTM - Applicazione mobile sanitaria,MEDBOX™ - Applicazione mobile per il settore sanitario,MEDBOX™ - App per la sanità mobile,0.3990606367588043,0.6829627156257629,0.7623461484909058,0.7092205286026001
Featured image - How to Use Citrus Juicer,https://www.dreamlandsdesign.com/wp-content/uploads/2020/04/How-to-Use-Citrus-Juicer-370x150.jpg,Immagine in evidenza - Come usare Citrus Juicer,Immagine in evidenza - Come usare lo spremiagrumi,Immagine selezionata - Come Usare un Centrifuga Limone,0.309906929731369,0.509154200553894,0.5203650593757629,0.5740865468978882
Route 66,https://thumbnails.yayimages.com/0/601/601d3f.jpg,Route 66,La Route 66,'Strada 66',0.2980453372001648,0.31472501158714294,0.2637988328933716,0.07275135070085526
"Project Tango, Google's all-seeing tablet experiment, will live on",http://l3.yimg.com/bt/api/res/1.2/HCydEzHsiOZIHAy1r7VDgg--/YXBwaWQ9eW5ld3M7Zmk9ZmlsbDt3aWR0aD0zMDA7aGVpZ2h0PTEyMDtweW9mZj0zMDtxPTc1/http://media.zenfs.com/en_US/News/The%20Verge/projecttango4_1020.1393331047.0.jpg.cf.jpg,"Progetto Tango , Google tutto-vedendo esperimento tablet , vivrà su","Project Tango, l'esperimento di Google con un tablet che vede tutto, continuerà a vivere","Il progetto Tango, l'esperimento di tablet di Google per vedere tutto, continuerà a esistere.",0.30277588963508606,0.5985134243965149,0.6325898766517639,0.6253063678741455
On the Nature of Marx's Things: Translation as Necrophilology,https://imgv2-2-f.scribdassets.com/img/word_document/373392360/149x198/0c56fc324f/0?v=1,Sulla natura delle cose di Marx: la traduzione come necrofilologia,Sulla natura delle cose di Marx: traduzione come necrofilologia,'On the Nature of Marx's Things: Translation as Necrophilology',0.32464203238487244,0.2993791103363037,0.29516831040382385,0.4160737991333008
Coating Aluminum Coil with Wood Grain Pattern pictures & photos,http://image.made-in-china.com/43f34j00COLQPGVALFkv/Coating-Aluminum-Coil-with-Wood-Grain-Pattern.jpg,Bobina di rivestimento in alluminio con motivo a grana di legno Immagini e foto,Bobina di alluminio di rivestimento con modello di grano di legno immagini e foto,Coating Aluminum Coil with Wood Grain Pattern pictures & photos,0.3220025599002838,0.5036696195602417,0.534366250038147,0.4708276689052582
Rebecca Minkoff leather hobo wine burgundy,https://di2ponv0v5otw.cloudfront.net/posts/2018/02/23/5a902fe1a44dbef204111b22/s_5a902ff39d20f09dfcc4e872.jpg,Rebecca Minkoff in pelle hobo vino bordeaux,Rebecca Minkoff hobo in pelle vino bordeaux,Borse Minkoff in pelle di uovo di gallina a macchina in color bordeaux.,0.3795735836029053,0.4635375440120697,0.4945412278175354,0.5213435292243958
"Mudroom storage bench plans And I built some rolling shoe storage to fit underneath the bench But we son t all have the space Check out these plans for a corner Mudroom Bench Plans, Mudroom Storage Bench, Mudroom Cubbies, Mudroom Laundry Room, Bench With Storage, Storage Ideas, Shoe Storage Benches, Pantry Storage, Kitchen Storage",https://i.pinimg.com/236x/2d/4f/35/2d4f35c36b0ca150755442dcc104f7b9--storage-benches-mudroom-storage-bench.jpg,"Piani di deposito di fango e ho costruito un certo deposito di scarpe rolling per adattarsi sotto la panca Ma noi figlio t tutti hanno lo spazio Check out questi piani per un angolo Piani di fango, Panchina di deposito di fango, Mudroom Cubbies, Mudroom Lavanderia, Panchina con stoccaggio, Idee di stoccaggio, Pattini di deposito scarpe, Pantry Storage, Cucina Storage","E ho costruito un po 'di stoccaggio di scarpe rotanti per adattarsi sotto la panchina Ma noi son t tutti hanno lo spazio Check out these plans for an corner Mudroom Bench Plans, Mudroom Storage Bench, Mudroom Cubbies, Mudroom Laundry Room, Bench With Storage, Storage Ideas, Shoe Storage Benches, Pantry Storage, Kitchen Storage","Traduzione dell'intero testo: 'Pianificazione di una panca per la pulizia, e ho costruito alcune scaffalie per lo stoccaggio delle scarpe in movimento sotto la panca. Ma tutti noi non abbiamo spazio, vedi questi piani per una panca per la pulizia nel punto di un angolo. Pianificazione di una panca per la pulizia, panca per la pulizia con stoccaggio, cubbietoli di pulizia, area di pulizia della laundry room, panca con stoccaggio, idee di stoccaggio, scaffalie per lo stoccaggio delle scarpe in movimento, stoccaggio della pantry, stoccaggio della cucina'",0.3434327244758606,0.48218441009521484,0.5121870040893555,0.5450628995895386
"""Black and White """"Zipper Teeth"""" pillow tutorial""",http://i2.wp.com/www.diaryofaquilter.com/wp-content/uploads/2015/09/Zipper-Teeth-Pillow-tutorial-DIY.jpg?resize=200%2C200,"""Black and White"" ""Zipper Denti"" ""tutorial cuscino""","""Tutorial di cuscino """"Denti a cerniera"""" in bianco e nero""","""Tutorial di un cuscino a zigzag a zigzag""",0.38608166575431824,0.4277493357658386,0.459673672914505,0.5729084610939026
"Man In Asian National Lothing, Male Representative Of Country In Traditional Outfit Of Nation Cartoo",https://static2.bigstockphoto.com/2/8/3/large2/382624781.jpg,"Uomo in Asian National Lothing, Maschio Rappresentante di Paese in Tradizionale Outfit di Nazione Cartoo","Uomo in lothing nazionale asiatico, rappresentante maschio del paese in abbigliamento tradizionale della nazione Cartoo","Il personaggio rappresenta un uomo in abbigliamento nazionale asiatico, rappresentante di un paese in costume tradizionale dell'nazione.",0.31969210505485535,0.5779943466186523,0.5608256459236145,0.5514166355133057
Hubble Just Took an Astonishingly Detailed Image of Saturn,https://www.aviationanalysis.net/wp-content/uploads/2020/07/Hubble-Just-Took-an-Astonishingly-Detailed-Image-of-Saturn.jpg,Hubble ha appena preso un'immagine sorprendentemente dettagliata di Saturno,Hubble ha appena scattato un'immagine sorprendentemente dettagliata di Saturno,Hubble ha catturato un'immagine estremamente dettagliata di Saturno.,0.30401483178138733,0.6005668044090271,0.6036484241485596,0.5875593423843384
Sparkling d'argento Love Wedding Gift Bags con Hang Tag,http://image.made-in-china.com/2f1j10tjBTMolcJUrP/Silver-Sparkling-Love-Wedding-.jpg,Borse regalo Sparkling d'argento Love con Hang Tag,Sparkling d'argento Love Wedding Gift Bags con Hang Tag,'Sparkling Silver Love Wedding Gift Bags with Hang Tag',0.31744980812072754,0.4588240385055542,0.5304049849510193,0.5199421644210815
Emotional Moments: The Art of Huskys. UK-Version (Wall Calendar,https://media.moluna.de/images/bilder/a5/215/../../a4/975/9781325016143_2_EN_9781325016143_30_BPR13-mini.JPG,Momenti emotivi: L'arte di Huskys. UK-Version (Calendario Wall),Momenti emozionali: l'arte di Husky. Versione italiana (Calendario da parete,'Momenti emotivi: Il Calendario della famiglia Husky. Versione UK (Calendario delle famiglie),0.3099741041660309,0.4272567927837372,0.4469008147716522,0.5634749531745911
My Cute golden puppy with kittens,https://i.pinimg.com/236x/8e/b5/75/8eb57519e6e9931e4886d2ea5119bfd7.jpg,Il mio carino cucciolo d'oro con gattini,Il mio cucciolo dorato sveglio con i gattini,Il mio piccolo cane d'oro con leone con leone.,0.31107988953590393,0.544362485408783,0.5667204856872559,0.3147141933441162
Cocktail drink vector,"http://cdn.vectorstock.com/i/composite/36,14/cocktail-drink-vector-473614.jpg",Cocktail drink vettoriale,Vettore di bevanda cocktail,Bevagna bevaganza cocktail illustrazione,0.3201771378517151,0.5850871205329895,0.6225788593292236,0.613964319229126
Recipe Card Tag ~Scraps of Darkness & Scrap for Help~,https://cdn.scrapbook.com/gallery/cache/60/600125/RecipeCard-Tag-800p_5.jpg,Tag della ricetta ~Scraps of Darkness & Scrap for Help~,Ricetta Card Tag ~ scarti di tenebre & scarti per aiuto ~,"Trasla in italiano la didascalia, dato l'immagine: 'Cartellone di ricette ~Scacchi di oscurità & Scacchi per aiuto~'",0.33217909932136536,0.36056947708129883,0.43669161200523376,0.33754682540893555
"Christina & Andrew's Wedding Reception at the Hilton Garden Inn in Allen, Texas | Wedding & Portrait Photography by Mary Cyrus in Dallas & Beyond",http://marycyrus.smugmug.com/photos/i-VsJTRbN/0/L/i-VsJTRbN-L.jpg,"Christina & Andrew's Wedding Reception at the Hilton Garden Inn in Allen, Texas | Wedding & Portrait Photography by Mary Cyrus in Dallas & Beyond","Ricevimento di nozze di Christina e Andrew presso l'Hilton Garden Inn di Allen, Texas | Fotografia di matrimoni e ritratti di Mary Cyrus a Dallas e oltre","La foto è la foto di un ricevimento di nozze di Christina e Andrew alla Hilton Garden Inn di Allen, Texas. La foto è stata scattata dal fotografo di matrimonio Mary Cyrus di Dallas e oltre.",0.3009962737560272,0.395114541053772,0.43432551622390747,0.4689525067806244
Marcy Eclipse Deluxe Smith Machine Gym,http://fitnessfighters.co.uk/wp-content/uploads/2017/12/71R2MiTeLAL._SY524_.jpg,Marcy Eclipse Deluxe Smith Machine Gym,Marcy Eclipse Deluxe Smith Palestra di Macchine,'Marcy Eclipse Deluxe Smith Machine Gym',0.32202062010765076,0.3504456877708435,0.5179963111877441,0.3580603003501892
These crafting kits are perfect for adults.,https://www.gannett-cdn.com/presto/2020/03/16/USAT/fb668b00-58e4-4a88-8890-ba91fef299d2-arts-crafts.png?width=580&height=326&fit=bounds&auto=webp,Questi kit di crafting sono perfetti per gli adulti.,Questi kit di crafting sono perfetti per gli adulti.,Questi kit di artigianato sono perfetti per adulti.,0.2942785322666168,0.5146219730377197,0.5146219730377197,0.5148416757583618
30th Anniversary Edition Marathon Classic Series Conga with Steely II Stand Leopard Burl 12.5,https://media.guitarcenter.com/is/image/MMGS7/30th-Anniversary-Edition-Marathon-Classic-Series-Conga-with-Steely-II-Stand-Leopard-Burl-12.5/491213000366076-00-220x220.jpg,30th Anniversary Edition Marathon Classic Series Conga con Stand Steely II Leopard Burl 12.5,Conga Marathon Classic Series con supporto Steely II Leopard Burl 12.5,30th Anniversary Edition Marathon Classic Series Conga with Steely II Stand Leopard Burl 12.5,0.3199882507324219,0.12323253601789474,0.1222371906042099,0.12512025237083435
Lone Star Flight Museum: great to see these working planes,https://media-cdn.tripadvisor.com/media/photo-s/04/39/cf/da/great-to-see-these-working.jpg,Lone Star Flight Museum: bello vedere questi aerei funzionanti,Lone Star Flight Museum: fantastico vedere questi aerei funzionanti,'Museo della Volo Lone Star: è fantastico vedere questi aerei in funzione',0.2935571074485779,0.626514196395874,0.6250165104866028,0.6179074645042419
LOUIS VUITTON AUTHENTIC METIS HOBO MONOGRAM (FL4112),https://cdn.shopify.com/s/files/1/1536/6939/products/IMG_4970_grande.jpg?v=1571327240,LOUIS VUITTON AUTENTIC METIS HOBO MONOGRAM (FL4112),LOUIS VUITTON AUTENTICO METIS HOBO MONOGRAM (FL4112),LOUIS VUITTON AUTENTIC METIS HOBO MONOGRAM (FL4112),0.35435277223587036,0.4560497999191284,0.4622642993927002,0.4560497999191284
Best Mosquito Pest Control in Phoenix Operators for Mosquito Eradication,https://www.papersopen.com/wp-content/uploads/2020/07/mosquito-control-phoenix-az-600x425.jpg,Miglior controllo zanzariera in operatori Phoenix per l'eradicazione della zanzara,Migliori Mosquito Pest Control a Phoenix Operatori per l'eradicazione delle zanzare,Il miglior controllo dei parassiti della mosca a Phoenix è fornito da operatori specializzati nella loro eliminazione.,0.31525060534477234,0.4323018193244934,0.3975914418697357,0.4807443916797638
"100 pcs Rare eggplant bonsai, flower potted plant, garden fruit trees, southern United States, Bonsai sweet fruit Easy to Grow",https://cdn.shopify.com/s/files/1/0098/2004/5370/products/100-pcs-Rare-eggplant-bonsai-flower-potted-plant-garden-fruit-trees-southern-United-States-Bonsai-sweet_150x150.jpg?v=1546984383,"100 pz Bonsai di melanzane rare, pianta in vaso di fiori, alberi da frutto da giardino, sud degli Stati Uniti, Bonsai frutta dolce Facile da coltivare","100 pz Rare melanzane bonsai, fiore in vaso, alberi da frutto del giardino, Stati Uniti meridionali, Bonsai frutta dolce facile da coltivare","100 pezzi di melanzane rare, piante da fiore in vaso, alberi da frutto del sud degli Stati Uniti, Fiocco dolce da piantare, facile da coltivare",0.33352887630462646,0.3825394809246063,0.3787759244441986,0.508384108543396
"low cost, green office, reclycled materials, green design",http://4.bp.blogspot.com/_aTGIzgrvSWw/SkwQImRrvsI/AAAAAAAAAQw/aHT-vuvZvdQ/s400/officepod01.jpg,"low cost, green office, materiali reclinati, green design","low cost, ufficio verde, materiali riciclati, design verde","low cost, green office, recycled materials, green design",0.28767129778862,0.5627509951591492,0.42772403359413147,0.43463316559791565
PATTERN ONLY Multicolor Adjustable Crochet Slouch Hat/ Tam/ Dreadlock Pattern with optional drawstring,https://i.etsystatic.com/6174345/c/570/452/0/165/il/eb9ba2/1441706599/il_340x270.1441706599_dkva.jpg,PATTERN SOLO Cappello crochet regolabile multicolore / Tam / Dreadlock modello con coulisse opzionale,Multicolore regolabile all'uncinetto Slouch Hat / Tam / Dreadlock modello con coulisse opzionale,PATTERN ONLY Multicolore Adjustabile Crochet Slouch Mütze/ Tam/ Dreadlock Muster mit optionalen Schleife,0.3203643560409546,0.625445544719696,0.5616317391395569,0.48779308795928955
